{
  "columnCount": 19,
  "featureColumns": [
    "momentum_5",
    "momentum_20",
    "momentum_60",
    "close_sma20_ratio",
    "close_sma60_ratio",
    "rsi14_wilder",
    "macd_signal_spread_ratio",
    "volatility20",
    "log_volume_z20",
    "market_return_5",
    "market_return_20",
    "relative_strength_5",
    "relative_strength_20",
    "base_rate_level",
    "base_rate_change_20",
    "usdkrw_return_5",
    "usdkrw_return_20"
  ],
  "logicalDatasetHash": "4444444444444444444444444444444444444444444444444444444444444444",
  "manifestVersion": "s5-feature-bundle-v2",
  "parquetFile": "features.parquet",
  "parquetSha256": "3333333333333333333333333333333333333333333333333333333333333333",
  "provenance": {
    "calendarName": "XKRX",
    "calendarVersion": "4.13.2",
    "datasetCutoff": "2026-08-17T23:10:00Z",
    "eligibleSessionCount": 1007,
    "eligibleSessionEnd": "2026-08-06",
    "eligibleSessionStart": "2022-06-28",
    "exchangeMic": "XKRX",
    "featurePolicyVersion": "s5-core-features-v1",
    "optionalFeatureGroups": [],
    "pitInputSha256": "8888888888888888888888888888888888888888888888888888888888888888",
    "producer": "decision-platform",
    "rawSessionCount": 1072,
    "rawSessionEnd": "2026-08-14",
    "rawSessionStart": "2022-04-01",
    "sourceBundleSetSha256": "5555555555555555555555555555555555555555555555555555555555555555",
    "sourcePolicySetSha256": "6666666666666666666666666666666666666666666666666666666666666666",
    "sourceWorkspace": "decision-platform",
    "temporalPolicyVersion": "s5-temporal-policy-v2",
    "temporalQuality": "RECONSTRUCTED_FIXED_LAG",
    "universePolicyVersion": "top30-plus-132030-v1",
    "universeScheduleSha256": "7777777777777777777777777777777777777777777777777777777777777777"
  },
  "rowCount": 1007,
  "schemaVersion": "s5-feature-table-v1"
}
